{
  "$schema": "https://json-schema.org/draft/2020-12/schema",
  "title": "Velk Store",
  "description": "Schema for a velk store file: flat object collection with hierarchies and extensible top-level collections.",

  "type": "object",
  "properties": {
    "version": { "type": "integer", "const": 1 },
    "objects": {
      "type": "array",
      "items": { "$ref": "#/$defs/object" }
    },
    "hierarchies": {
      "type": "object",
      "additionalProperties": { "$ref": "#/$defs/hierarchy" }
    },
    "attachments": {
      "type": "array",
      "items": { "$ref": "#/$defs/attachment" }
    },
    "bindings": {
      "type": "array",
      "items": { "$ref": "#/$defs/binding" }
    },
    "resource-protocols": {
      "type": "array",
      "description": "Registers filesystem-backed protocol handlers for custom URI schemes.",
      "items": { "$ref": "#/$defs/resource_protocol" }
    },
    "resources": {
      "type": "array",
      "description": "Resource objects (same structure as objects, stored with 'resource:' prefix). Referenced via { \"ref\": \"resources.<id>\" }.",
      "items": { "$ref": "#/$defs/object" }
    }
  },
  "required": ["version", "objects"],
  "additionalProperties": true,

  "$defs": {
    "uid": {
      "type": "string",
      "pattern": "^[0-9a-f]{8}-[0-9a-f]{4}-[0-9a-f]{4}-[0-9a-f]{4}-[0-9a-f]{12}$"
    },

    "class": {
      "type": "string",
      "description": "Class name, optionally plugin-scoped with dot notation (e.g. 'velk-ui.Window'), or a UUID string."
    },

    "value": {
      "oneOf": [
        { "type": "number" },
        { "type": "string" },
        { "type": "boolean" },
        { "type": "integer" },
        { "type": "array", "items": { "type": "number" } }
      ]
    },

    "object_reference": {
      "type": "object",
      "description": "Object reference for ObjectRef properties. Only valid on properties of type ObjectRef.",
      "properties": {
        "ref": { "type": "string", "description": "Path to the referenced object (e.g. 'panel_a1' or '/scene/root/child')." },
        "type": {
          "type": "string",
          "enum": ["strong", "weak"],
          "default": "strong"
        }
      },
      "required": ["ref"]
    },

    "inline_binding": {
      "type": "object",
      "description": "Inline one-way binding from a source property.",
      "properties": {
        "bind": { "type": "string", "description": "Source property path (e.g. 'widget_1.width')." }
      },
      "required": ["bind"]
    },

    "property_value": {
      "description": "Property value: bare value (shorthand), object ref, inline binding, or object form with value and optional flags.",
      "oneOf": [
        { "$ref": "#/$defs/value" },
        { "$ref": "#/$defs/object_reference" },
        { "$ref": "#/$defs/inline_binding" },
        {
          "type": "object",
          "properties": {
            "value": { "$ref": "#/$defs/value" },
            "flags": { "type": "integer", "default": 0 }
          },
          "required": ["value"]
        }
      ]
    },

    "object": {
      "type": "object",
      "properties": {
        "id": { "type": "string", "description": "Unique identifier within this store." },
        "name": { "type": "string", "description": "Optional human-readable name." },
        "class": { "$ref": "#/$defs/class" },
        "properties": {
          "type": "object",
          "additionalProperties": { "$ref": "#/$defs/property_value" }
        }
      },
      "required": ["id", "class"]
    },

    "hierarchy": {
      "type": "object",
      "description": "Map of parent id to array of child ids.",
      "additionalProperties": {
        "type": "array",
        "items": { "type": "string" }
      }
    },

    "attachment": {
      "type": "object",
      "description": "Creates a single object instance and attaches it to one or more targets.",
      "properties": {
        "targets": {
          "type": "array",
          "items": { "type": "string" },
          "description": "Object ids or paths to attach to."
        },
        "class": { "$ref": "#/$defs/class" },
        "properties": {
          "type": "object",
          "additionalProperties": { "$ref": "#/$defs/property_value" }
        }
      },
      "required": ["targets", "class"]
    },

    "resource_protocol": {
      "type": "object",
      "description": "Registers a FileProtocol instance with a custom scheme and optional base path.",
      "properties": {
        "scheme": { "type": "string", "description": "URI scheme to register (e.g. 'assets')." },
        "base_path": { "type": "string", "description": "Filesystem path prepended to all resolved paths." }
      },
      "required": ["scheme"]
    },

    "binding": {
      "type": "object",
      "properties": {
        "source": { "type": "string", "description": "Source property path (e.g. 'panel_a1.width')." },
        "targets": { "type": "array", "items": { "type": "string" }, "description": "Target property paths." },
        "mode": { "type": "string", "enum": ["oneway", "twoway"], "default": "oneway" },
        "invoke": { "type": "string", "enum": ["auto", "immediate", "deferred"], "default": "auto" }
      },
      "required": ["source", "targets"]
    }
  }
}
