{
  "version": 1,
  "resource-protocols": [
    { "scheme": "assets", "base_path": "./assets/" }
  ],
  "resources": [
    {
      "id": "main_font",
      "class": "velk-ui.Font",
      "properties": { "uri": "assets://default.ttf" }
    }
  ],
  "objects": [
    {
      "id": "panel_a1",
      "name": "Main Panel",
      "class": "velk-ui.Panel",
      "properties": {
        "width": 800,
        "height": 600,
        "title": "My Application"
      }
    },
    {
      "id": "btn_b2",
      "name": "OK",
      "class": "velk-ui.Button",
      "properties": {
        "label": "OK",
        "width": { "value": 120, "flags": 0 }
      }
    },
    {
      "id": "btn_c3",
      "name": "Cancel",
      "class": "velk-ui.Button",
      "properties": {
        "label": "Cancel",
        "width": 120
      }
    },
    {
      "id": "label_d4",
      "name": "Status",
      "class": "velk-ui.Label",
      "properties": {
        "text": { "ref": "panel_a1.title" }
      }
    }
  ],
  "hierarchies": {
    "main": {
      "panel_a1": ["btn_b2", "btn_c3", "label_d4"]
    }
  },
  "attachments": [
    {
      "targets": ["panel_a1"],
      "class": "velk-ui.Stack",
      "properties": { "axis": 1, "spacing": 10 }
    },
    {
      "targets": ["btn_b2"],
      "class": "velk-ui.FixedSize",
      "properties": { "width": 120, "height": 40 }
    },
    {
      "targets": ["btn_c3"],
      "class": "velk-ui.FixedSize",
      "properties": { "width": 120, "height": 40 }
    }
  ],
  "bindings": [
    {
      "source": "panel_a1.width",
      "targets": ["btn_b2.width"]
    }
  ]
}
